{
  "os": "macos",
  "packages": {
    "public": ["dot_home", "dot_config_common", "dot_config_macos"],
    "private": []
  },
  "templates": {
    "dot_home/.gitconfig": {
      "user.email": "op://Personal/Git/email",
      "user.name": "op://Personal/Git/name",
      "user.signingkey": "op://Personal/Git/signingkey"
    }
  },
  "private_repo": {
    "url": "git@github.com:josh-allan/private-dots.git",
    "branch": "main"
  },
  "skip_paths": []
}
