{
  "os": "macos",
  "packages": {
    "public": [
      "dot_home",
      "dot_config_common",
      "dot_config_macos",
      "host_M-J7KGT9QHDJ"
    ],
    "private": [
      "private_user",
      "private_work",
      "opencode",
      "please",
      "augment"
    ]
  },
  "templates": {
    "dot_home/.gitconfig": {
      "user.email": "op://Work/Git Email/username",
      "user.name": "op://Work/user/username",
      "user.signingkey": "op://Work/Git Signing Key/public key"
    },
    "dot_home/.zshrc": {}
  },
  "private_repo": {
    "url": "git@github.com:josh-allan/private-dots.git",
    "branch": "main"
  },
  "repos": [
    {
      "url": "git@github.com:josh-allan/go-git",
      "target": "~/src/go-git",
      "branch": "main"
    }
  ],
  "skip_paths": [],
  "compliance": {
    "schemaVersion": 1,
    "packages": {
      "mode": "expected",
      "expected": [],
      "absent": []
    },
    "services": {
      "mode": "off"
    },
    "files": {
      "mode": "expected",
      "expected": []
    }
  }
}
