{
  "os": "linux",
  "packages": {
    "public": [
      "dot_home",
      "dot_config_common",
      "dot_config_linux"
    ],
    "private": [
      "private_user",
      "opencode",
      "claude",
      "augment"
    ],
    "system": [
      {
        "pkg": "etc_linux",
        "target": "/etc"
      }
    ]
  },
  "templates": {
    "dot_home/.gitconfig": {
      "user.email": "op://Personal/Git Email/username",
      "user.name": "op://Personal/user/username",
      "user.signingkey": "op://Personal/Git Signing Key/public key"
    },
    "dot_home/.zshrc": {}
  },
  "private_repo": {
    "url": "git@github.com:josh-allan/private-dots.git",
    "branch": "main"
  },
  "repos": [
    {
      "url": "git@github.com:josh-allan/go-git",
      "target": "~/src/go-git",
      "branch": "main"
    }
  ],
  "skip_paths": [],
  "compliance": {
    "schemaVersion": 1,
    "packages": {
      "mode": "expected",
      "expected": [],
      "absent": []
    },
    "services": {
      "mode": "off"
    },
    "files": {
      "mode": "expected",
      "expected": []
    }
  }
}
